{
  "$schema": "https://json-schema.org/draft/2020-12/schema",
  "$id": "https://superrtp.org/schemas/slot_mapping.schema.json",
  "title": "SuperRTP Slot Mapping",
  "type": "object",
  "required": [
    "target",
    "target_name",
    "engine",
    "reference_source",
    "slots"
  ],
  "properties": {
    "target": { "type": "string" },
    "target_name": { "type": "string" },
    "engine": { "type": "string" },
    "reference_source": { "type": "string" },
    "slots": {
      "type": "object",
      "additionalProperties": {
        "type": "object",
        "required": [
          "asset_id",
          "category",
          "slot_path",
          "test_only"
        ],
        "properties": {
          "asset_id": { "type": "string" },
          "category": { "type": "string" },
          "slot_path": { "type": "string" },
          "aliases": {
            "type": "array",
            "items": { "type": "string" }
          },
          "upstream_aliases": {
            "type": "array",
            "items": { "type": "string" }
          },
          "emitted_case_variants": {
            "type": "array",
            "items": { "type": "string" }
          },
          "format": { "type": "string" },
          "dimensions": {
            "type": "array",
            "items": { "type": "integer" },
            "minItems": 2,
            "maxItems": 2
          },
          "character_index": { "type": "integer" },
          "source_character_indices": {
            "type": "array",
            "items": { "type": "integer" }
          },
          "transform_policy": { "type": "string" },
          "test_only": { "type": "boolean" }
        },
        "additionalProperties": false
      }
    }
  },
  "additionalProperties": false
}
