{
  "target": "rm2003",
  "target_name": "RPG Maker 2003 Runtime Package",
  "engine": "RPG Maker 2003",
  "reference_source": "EasyRPG Player src/rtp_table.cpp (rtp_table_2k3, commit 78328fa / v0.8.1.1)",
  "slots": {
    "CharSet/Actor1.png": {
      "asset_id": "test.calibration.walking-character",
      "category": "CharSet",
      "slot_path": "CharSet/Actor1.png",
      "upstream_aliases": [
        "CharSet/actor1.png",
        "CharSet/hero1.png",
        "CharSet/chara1.png",
        "CharSet/protagonist1.png",
        "CharSet/主人公1.png",
        "CharSet/주인공1.png",
        "CharSet/主角1.png"
      ],
      "emitted_case_variants": [
        "CharSet/Hero1.png",
        "CharSet/Chara1.png",
        "CharSet/Protagonist1.png"
      ],
      "aliases": [
        "CharSet/actor1.png",
        "CharSet/hero1.png",
        "CharSet/Hero1.png",
        "CharSet/chara1.png",
        "CharSet/Chara1.png",
        "CharSet/protagonist1.png",
        "CharSet/Protagonist1.png",
        "CharSet/主人公1.png",
        "CharSet/주인공1.png",
        "CharSet/主角1.png"
      ],
      "format": "indexed-png",
      "dimensions": [288, 256],
      "test_only": true
    }
  }
}
