{
  "target": "rm2000",
  "target_name": "RPG Maker 2000 Runtime Package",
  "engine": "RPG Maker 2000",
  "reference_source": "EasyRPG Player src/rtp_table.cpp (rtp_table_2k, commit 78328fa / v0.8.1.1)",
  "slots": {
    "CharSet/Actor1.png": {
      "asset_id": "test.calibration.walking-character",
      "category": "CharSet",
      "slot_path": "CharSet/Actor1.png",
      "aliases": [
        "CharSet/actor1.png",
        "CharSet/chara1.png",
        "CharSet/Chara1.png",
        "CharSet/主人公1.png"
      ],
      "format": "indexed-png",
      "dimensions": [288, 256],
      "test_only": true
    }
  }
}
