{
  "target": "rmxp",
  "target_name": "RPG Maker XP Runtime Package",
  "engine": "RPG Maker XP",
  "reference_source": "mkxp-z / RGSS1 Character Specification (commit 826929eeb3ebc4b887c011604919217a790770f4)",
  "slots": {
    "Graphics/Characters/001-Fighter01.png": {
      "asset_id": "test.calibration.walking-character",
      "category": "Character",
      "slot_path": "Graphics/Characters/001-Fighter01.png",
      "aliases": [],
      "format": "truecolor-rgba-png",
      "dimensions": [
        96,
        128
      ],
      "character_index": 0,
      "transform_policy": "rm2k_to_rgss1_character_4x4_idle_first_v2",
      "test_only": true
    }
  }
}
